,Name,Url,Ingredients,Calories,Carbs Grams,Protein Grams,Fat Grams
0,Raspberry Almond Baked Oatmeal,https://www.eatyourselfskinny.com/raspberry-almond-baked-oatmeal/,"['1½ cups rolled oats', '1 tsp. ground ginger', '½ tsp. salt', '¼ cup dry-roasted almonds coarsely chopped', '2 cups of unsweetened almond milk (or milk of choice)', '¼ cup honey (or maple syrup)', '2 Tbsp olive oil', '1 tsp. vanilla', '1 cup fresh raspberries + more for topping']",211.0,31.9,4.4,8.7
1,Grandma’s Easy Banana Bread,https://www.eatyourselfskinny.com/grandmas-banana-bread/,"['½ cup (1 stick) butter softened', '1 cup sugar', '2 eggs', '1 tsp. vanilla', '½ cup sour cream (or plain Greek yogurt)', '1 cup mashed bananas (about 2 bananas)', '1½ cups all-purpose flour', '1 tsp. baking soda', '½ tsp. salt']",218.0,32.7,3.7,8.5
2,Banana Oat Breakfast Smoothie,https://www.eatyourselfskinny.com/banana-oat-breakfast-smoothie/,"['⅓ cup rolled oats', '½ cup yogurt (I used Silk Almondmilk yogurt)', '1 banana', '1 Tbsp flaxseed meal', '½ tsp. cinnamon', '½ cup almond milk']",210.0,32.5,5.6,7.5
3,Salted Caramel Overnight Oats,https://www.eatyourselfskinny.com/salted-caramel-overnight-oats/,"['⅓ cup rolled oats', '¼ cup unsweetened almond milk', '2 Tbsp caramel flavored almond creamer', '1 Tbsp chia seeds', '½ banana mashed', '½ tsp. cinnamon', 'Toppings: cacao nibs chopped cashews banana slices & caramel sauce', '1 cup full fat coconut milk', '⅓ cup coconut sugar', '½ tsp. sea salt', '½ tsp. vanilla extract (optional)']",274.0,43.6,5.9,8.4
4,Carrot Cake Breakfast Bars,https://www.eatyourselfskinny.com/carrot-cake-oatmeal-breakfast-bars/,"['2½ cups rolled oats', '1 tsp. baking powder', '2 tsp. cinnamon', '¼ tsp. nutmeg', '¼ tsp. sea salt', '1 egg', '1 cup Silk Protein Nutmilk (or milk of choice)', '¼ cup coconut oil melted and cooled slightly', '⅓ cup maple syrup', '1 tsp. vanilla', '½ cup grated carrots', '½ cup (4 oz) less-fat cream cheese softened (use vegan cream cheese if dairy-free!)', '1 Tbsp maple syrup', '½ tsp. vanilla']",125.0,16.2,3.3,5.9
5,Easy Sweet Potato Hashbrowns,https://www.eatyourselfskinny.com/easy-sweet-potato-hashbrowns/,"['2 sweet potatoes peeled and grated', '½ onion chopped', '3 Tbsp grass fed butter (or coconut oil)', '½ tsp. sea salt', '¼ tsp. cinnamon', '¼ tsp. chili powder', 'Pinch of ground black pepper']",230.0,29.9,2.6,11.6
6,Blueberry Banana Almond Flour Pancakes,https://www.eatyourselfskinny.com/blueberry-banana-almond-flour-pancakes/,"['1 cup almond flour', '1 tsp. baking powder', '4 eggs lightly whisked', '1 banana mashed', '¼ cup Silk Vanilla Almond Creamer', '¾ cup blueberries']",144.0,10.7,6.3,9.5
7,The BEST Almond Flour Pumpkin Bread,https://www.eatyourselfskinny.com/the-best-almond-flour-pumpkin-bread/,"['2 cups almond flour', '2 tsp. baking powder', '1 tsp. baking soda', '2 tsp. pumpkin pie spice', '½ tsp. cinnamon', '¼ tsp. nutmeg', '¼ tsp. sea salt', '3 eggs lightly whisked', '¼ cup coconut oil melted', '¼ cup pure maple syrup', '1 (15 oz) can 100% pumpkin puree', '3 oz ⅓-less fat cream cheese', '2 Tbsp powdered sugar', '1-2 Tbsp almond milk (or milk of choice)']",206.0,13.4,7.3,14.3
8,Easy 3-Ingredient Granola,https://www.eatyourselfskinny.com/easy-3-ingredient-granola/,"['3 cups rolled oats', '¼ cup coconut oil melted', '⅓ cup maple syrup', 'Optional: ½ tsp. cinnamon']",137.0,22.5,3.0,5.1
9,Strawberry Jam Filled Oat Muffins,https://www.eatyourselfskinny.com/strawberry-jam-filled-oat-muffins/,"['2 cups whole wheat flour', '½ cup oat flour', '1 Tbsp baking powder', '½ cup Stevia In The Raw®', '½ tsp. salt', '2 eggs', '1 cup unsweetened almond milk', '2 Tbsp coconut oil melted', '1 Tbsp honey', '1 tsp. vanilla', '¼ cup strawberry jam (I used sugar-free)']",132.0,21.6,4.3,3.9
10,Triple Berry Smoothie Bowl,https://www.eatyourselfskinny.com/triple-berry-smoothie-bowl/,"['1 cup frozen mixed berries', '½ cup unsweetened almond milk', '3 Tbsp plain Greek yogurt', 'Ice for thickening', 'Fresh fruit (I used blueberries raspberries and blackberries)', 'Granola', 'Hemp hearts', 'Chia seeds']",121.0,19.4,6.0,1.8
11,Overnight Blueberry French Toast Casserole,https://www.eatyourselfskinny.com/overnight-blueberry-french-toast-casserole/,"['1 (14-16 oz) loaf whole wheat french bread cut into 1-inch cubes', '2 cups AllWhites® 100% liquid egg whites', '2 cups unsweetened almond milk', '¼ cup pure maple syrup', '1 Tbsp vanilla', '2 tsp. cinnamon', '¼ tsp.nutmeg', 'Pinch of salt', '1 cup fresh or frozen blueberries', 'Optional toppings: powdered sugar maple syrup extra blueberries']",116.0,20.9,6.5,0.9
12,Peanut Butter and Banana Overnight Oats,https://www.eatyourselfskinny.com/peanut-butter-and-banana-overnight-oats/,"['½ cup rolled oats', '½ cup vanilla almond milk', '1 Tbsp chia seeds', '½ banana mashed', '1½ Tbsp peanut butter', 'Toppings: banana slices coconut flakes dollop of peanut butter and chunks of Peanut Butter Cookie Larabar']",369.0,45.2,13.0,13.2
13,Strawberry Chia Overnight Oats,https://www.eatyourselfskinny.com/strawberry-chia-overnight-oats/,"['⅓ cup rolled oats', '½ cup Silk Protein Nutmilk', '1 Tbsp chia seeds', '1 tsp. honey (or maple syrup)', '½ tsp. vanilla', '1 Tbsp strawberry chia seed jam (see recipe below)', '1 cup strawberries chopped', '1 Tbsp honey (or maple syrup)', '1 Tbsp chia seeds', 'Strawberry chia seed jam', 'Sliced strawberries', 'Granola']",261.0,37.2,10.6,9.0
14,Ginger Peach Detox Smoothie,https://www.eatyourselfskinny.com/ginger-peach-detox-smoothie/,"['1 cup baby spinach leaves packed', '2 cups frozen peaches', '½ ripe banana', '1 Tbsp grated ginger', '¼ cup plain Greek yogurt', '1 packet Born Sweet Zing Organic Stevia Sweetener', '1 cup coconut water (or liquid of choice)', 'Ice (optional)']",123.0,26.7,5.5,0.4
15,Quinoa Egg White Breakfast Wrap,https://www.eatyourselfskinny.com/quinoa-egg-white-breakfast-wrap/,"['½ cup uncooked quinoa', '½ tsp. cumin', '¼ cup your favorite salsa', '1 Tbsp cilantro chopped', '1 cup AllWhites 100% liquid egg whites', 'Pinch of salt and pepper', '2 cups baby spinach', '4 (10 inch) whole wheat tortillas', 'Optional toppings: avocado tomatoes shredded cheese']",298.0,45.4,13.4,5.9
16,Baked Egg and Roasted Veggie Casserole,https://www.eatyourselfskinny.com/baked-egg-and-roasted-veggie-casserole/,"['3 cups broccoli florets', '2 cups sweet potatoes cubed', '1 red onion cut in wedges', '1 Tbsp olive oil', '¼ tsp. salt', '8 eggs', '½ cup shredded cheese', '½ tsp. black pepper']",301.0,21.9,19.2,15.7
17,Lemon Blueberry Blender Muffins,https://www.eatyourselfskinny.com/lemon-blueberry-blender-muffins/,"['½ cup plain Greek yogurt', '3 eggs', 'Juice of 1 lemon', '2 tsp. lemon zest', '¼ cup honey*', '1 tsp. vanilla extract', '3 cups almond flour', '1½ tsp. baking powder', '½ tsp. baking soda', '¼ tsp. salt', '1 cup blueberries fresh or frozen']",215.0,15.2,8.6,14.3
18,Slow Cooker Berry Breakfast Quinoa,https://www.eatyourselfskinny.com/slow-cooker-berry-breakfast-quinoa/,"['2 ripe bananas mashed', '4 cups water', '2 cups quinoa rinsed', '2 cups fresh or frozen mixed berries (blueberries strawberries raspberries etc.)', '2 Tbsp maple syrup', '2 tsp. vanilla', '1 tsp. cinnamon', '¼ tsp. salt']",229.0,44.2,7.0,2.8
19,Egg White and Avocado Salad,https://www.eatyourselfskinny.com/egg-white-avocado-salad/,"['10 hard boiled egg whites diced', '1 avocado mashed', '1 Tbsp Dijon mustard', '1 Tbsp plain Greek yogurt', '2 tsp. fresh lemon juice', '⅓ cup green onions chopped', '½ cup celery diced', '½ tsp. paprika', '¼ tsp. pepper', 'Pinch of sea salt', '2 slices uncured turkey bacon chopped']",154.0,6.9,12.1,8.9
20,Healthy Breakfast Enchiladas,https://www.eatyourselfskinny.com/healthy-breakfast-enchiladas/,"['1 Tbsp olive oil', '12 oz. turkey breakfast sausage', '1 small onion chopped', '8 eggs', 'Salt and pepper to taste', '10 (6 inch) whole wheat flour tortillas', '2 cups ranchero sauce (or your favorite enchilada sauce)', '½ cup shredded Mexican cheese', '1 Tbsp olive oil', '1 small onion chopped', '3 cloves garlic minced', '1 red bell pepper chopped', '1 jalapeño de-seeded and chopped', '1 tsp. cumin', '1 tsp. salt', '1 (10 oz) can diced tomatoes with green chiles', '1 cup low-sodium chicken broth', '3 Tbsp chopped cilantro', '1 avocado chopped', '1 cup cherry tomatoes halved', '3 Tbsp green onions chopped', 'Handful cilantro chopped']",265.0,19.5,15.5,12.1
21,No Bake Almond Butter Granola Bars,https://www.eatyourselfskinny.com/no-bake-almond-butter-granola-bars/,"['2 cups old fashioned rolled oats', '1 cup puffed rice cereal', '4 Tbsp coconut oil', '¼ cup light brown sugar', '½ cup almond butter', '¼ cup honey', '½ tsp. vanilla extract', '3 Tbsp mini chocolate chips (divided)', 'Pinch of sea salt']",145.0,16.6,2.3,7.2
22,Healthy Veggie Egg Muffins,https://www.eatyourselfskinny.com/healthy-veggie-egg-muffins/,"['1 Tbsp olive oil', '½ yellow onion chopped', '2 cloves garlic minced', '½ zucchini shredded', '1 red bell pepper chopped', '8 large eggs', '2 cups arugula roughly chopped', '¼ cup shredded Parmesan cheese', 'Salt and pepper to taste']",75.0,2.5,5.1,4.9
23,Banana Nut Bran Muffins,https://www.eatyourselfskinny.com/banana-bran-muffins/,"['1½ cups wheat bran', '½ cup unsweetened almond milk (or milk of your choice)', '2 medium bananas mashed', '1 egg', '1 Tbsp coconut oil melted and cooled', '1½ tsp. vanilla', '½ cup honey', '1 cup whole wheat flour', '1½ tsp. baking powder', '½ tsp. baking soda', '1 tsp. cinnamon', '¼ tsp. nutmeg', 'Pinch of salt', '3 Tbsp chopped walnuts (optional)']",120.0,23.1,3.1,2.1
24,Healthy Zucchini Bread,https://www.eatyourselfskinny.com/healthy-zucchini-bread/,"['1 cup unbleached all-purpose flour', '½ cup whole wheat flour', '1 tsp. baking powder', '½ tsp. baking soda', '1½ tsp. cinnamon', '¼ tsp. nutmeg', '½ tsp. salt', '1 egg', '½ cup plain Greek yogurt', '¼ cup coconut oil melted and cooled', '½ cup honey', '2 Tbsp brown sugar', '1 tsp. vanilla', '1½ cups grated zucchini water squeezed out']",161.0,26.2,3.7,5.0
25,Tropical Green Smoothie Bowl,https://www.eatyourselfskinny.com/tropical-green-smoothie-bowl/,"['½ cup frozen mango', '½ cup frozen pineapple', '¼ cup plain Greek yogurt', '1 cup spinach', 'Few mint leaves torn', '1 cup coconut water', 'Toppings: kiwi slices shredded coconut and chia seeds']",208.0,28.1,9.1,2.1
26,Vanilla Almond Oatmeal with Blueberries,https://www.eatyourselfskinny.com/vanilla-almond-oatmeal-with-blueberries/,"['2 cups vanilla almond milk', '1 cup water', '¼ tsp. salt', '1 cup steel cut oats', '1 tsp. vanilla extract', '1 tsp. almond extract', '½ tsp. cinnamon', '1 Tbsp honey']",189.0,32.5,5.5,4.3
27,My Favorite Veggie Frittata,https://www.eatyourselfskinny.com/my-favorite-veggie-frittata/,"['1 Tbsp olive oil', '2 cloves garlic minced', '1 small onion chopped', '½ red bell pepper chopped', '½ green bell pepper chopped', '½ zucchini shredded', '½ cup broccoli florets', '¼ cup sun dried tomatoes chopped', '6 eggs', '2 Tbsp almond milk', '¼ cup Parmesan cheese', '1 tsp. dried oregano', '¼ tsp. red pepper flakes', '½ tsp. pepper', 'Pinch of sea salt']",130.0,5.4,8.2,8.1
28,Banana Breakfast Muffins,https://www.eatyourselfskinny.com/banana-breakfast-muffins/,"['1⅓ cup whole wheat flour', '1 tsp. baking powder', '½ tsp. baking soda', '¼ tsp. sea salt', '½ tsp. cinnamon', '1 large egg', '3 ripe bananas mashed', '½ cup unsweetened applesauce', '¼ cup honey', '1 tsp. vanilla', '3 Tbsp plain Greek yogurt']",106.0,23.8,3.0,0.8
29,No Bake Apple Peanut Butter Cookies,https://www.eatyourselfskinny.com/no-bake-apple-peanut-butter-cookies/,"['4 Tbsp coconut oil', '⅓ cup all-natural peanut butter', '2 Tbsp honey', '½ tsp. vanilla', '1 cup puffed rice cereal', '1 cup rolled oats', '⅓ cup dried apples crushed slightly', '2 Tbsp chopped peanuts', '2 Tbsp ground flax seed', '¼ tsp. apple pie spice', '¼ cup white chocolate chips melted']",113.0,10.2,2.6,6.0
30,{Healthy} Harvest Pancakes,https://www.eatyourselfskinny.com/healthy-harvest-pancakes/,"['¼ cup almond flour (or flour of your choice)', '1 tsp. baking soda', '½ tsp. cinnamon', '¼ tsp. nutmeg', '4 eggs lightly beaten', '½ banana mashed', '1 tsp. vanilla']",103.0,4.5,6.1,6.7
31,Apple Cider Oatmeal Crisp,https://www.eatyourselfskinny.com/apple-cider-oatmeal-crisp/,"['6 apples peeled and sliced', '2 cups fresh apple cider', '⅓ cup maple syrup', '2 cinnamon sticks', '1 cup rolled oats', '½ cup pecans roughly chopped', '½ cup + 2 Tbsp almond four', '¼ cup apple cider mixture', '1 tsp. vanilla', '1 tsp. cinnamon', '½ tsp. allspice', '¼ tsp. salt']",254.0,42.4,3.7,9.3
32,Skinny Pumpkin Spice Mug Cake,https://www.eatyourselfskinny.com/skinny-pumpkin-spice-mug-cake/,"['4 Tbsp white whole wheat flour', '½ tsp. baking powder', '¼ tsp. cinnamon', '¼ tsp. pumpkin pie spice', 'Pinch of nutmeg', '1 Tbsp maple syrup (or 1 Tbsp brown sugar)', '2 tsp. pumpkin puree', '2 Tbsp almond milk (or milk of your choice)', '1½ tsp. unsweetened apple sauce', '¼ tsp. vanilla extract']",181.0,34.9,4.3,1.0
33,{Healthy} Blueberry Lemon Bread Pudding,https://www.eatyourselfskinny.com/healthy-blueberry-lemon-bread-pudding/,"['5 cups crusty whole wheat bread cut into 2-inch squares', '1½ cups almond milk (or milk of your choice)', '½ cup unsweetened applesauce', '2 eggs lightly beaten', '1 Tbsp honey', '1 Tbsp light brown sugar', '½ tsp. vanilla', '¼ tsp. sea salt', 'Zest of 1 lemon', '1 pint blueberries']",240.0,43.8,8.3,4.3
34,{Healthy} Turkey and Sweet Potato Hash,https://www.eatyourselfskinny.com/healthy-turkey-and-sweet-potato-hash/,"['3 cups sweet potatoes peeled and cubed', '1 Tbsp olive oil', '1 yellow onion chopped', '1 clove garlic minced', '1 lb 99% fat-free ground turkey', '1 zucchini diced', '1 red bell pepper chopped', '1 tsp. ground cumin', '1 tsp. smoked paprika', '½ tsp. chili powder', '½ tsp. sea salt', '1 tsp. fresh parsley finely chopped']",264.0,25.9,30.8,4.8
35,Blueberry Muffin Overnight Oats,https://www.eatyourselfskinny.com/blueberry-muffin-overnight-oats/,"['⅓ cup old-fashioned rolled oats', '⅓ cup plain Greek yogurt', '⅓ cup unsweetened almond milk', '1 Tbsp chia seeds', '½ Tbsp agave (or honey)', '1 tsp. vanilla extract', '¼ tsp. cinnamon', '¼ cup blueberries']",275.0,41.0,13.4,5.8
36,Protein Breakfast Muffins,https://www.eatyourselfskinny.com/protein-breakfast-muffins/,"['¼ cup plain Greek yogurt', '¾ cup unsweetened applesauce', '½ cup brown sugar', '1 egg', '½ tsp. vanilla extract', '1 cup grated carrot', '1 cup grated zucchini', '¾ cup whole wheat flour', '¾ cup all purpose flour', '¼ cup protein powder (I used Perfect Fit)', '2 tsp. baking powder', '1 tsp. cinnamon', '½ tsp. nutmeg', '½ tsp. salt']",118.0,24.8,4.2,0.6
37,Homemade KIND Bars,https://www.eatyourselfskinny.com/homemade-kind-bars/,"['½ cup unsalted roasted almonds whole', '½ cup unsalted dry roasted peanuts whole', '½ cup roasted walnuts chopped', '⅓ cup puffed rice', '1 Tbsp flaxseed meal', '¼ cup brown rice syrup', '2 Tbsp honey', '½ tsp vanilla', '½ tsp sea salt', '½ cup dark chocolate chips']",210.0,17.5,4.1,12.0
38,Juice Pulp Muffins,https://www.eatyourselfskinny.com/juice-pulp-muffins/,"['3 cups whole wheat flour', '¼ cup flax seed meal', '½ tsp. salt', '1 Tbsp baking powder', '1 tsp. cinnamon', '½ tsp. nutmeg', '2 cups fruit/veggie pulp (I used approximately 1 bunch kale 4 carrots 2 green apples and 1 large chunk of fresh ginger)', '½ cup plain Greek yogurt', '½ banana mashed', '½ cup unsweetened almond milk', '½ cup maple syrup (or honey)', '1 tsp. vanilla extract', 'Handful of rolled oats']",85.0,17.8,2.9,0.7
39,Kale Juice,https://www.eatyourselfskinny.com/why-i-love-juicing/,"['6 leaves kale (1 bunch)', '2 stalks celery', '2 green apples', '2 pears', '1 lime']",168.0,46.5,6.2,1.5
40,Mango Avocado Smoothie,https://www.eatyourselfskinny.com/mango-avocado-smoothie/,"['1 ripe avocado peeled pitted and chopped', '2 cups frozen mango cubes', '1 cup fresh orange juice', '½ cup water', 'Handful of mint chopped']",145.0,25.0,2.0,5.0
41,Strawberry Basil Scones,https://www.eatyourselfskinny.com/strawberry-basil-scones-for-voskos/,"['1½ cups whole wheat flour', '1¼ cups rolled oats', '¼ cup raw sugar', '1 tsp baking powder', '¼ tsp. sea salt', '6 Tbsp unsalted butter melted and cooled', '½ cup strawberry Greek yogurt such as Voskos', '⅓ cup fat-free milk', '½ tsp. vanilla extract', '1 cup chopped strawberries', 'Handful fresh basil chopped']",198.0,27.8,5.8,8.0
42,Clean Blueberry Protein Muffins,https://www.eatyourselfskinny.com/clean-blueberry-protein-muffins/,"['2½ cups protein powder', '1½ cups eggs whites', '3 Tbsp almond flour', '2 Tbsp ground flaxseed', '3 Tbsp unsweetened almond milk', '2 Tbsp water', '1 mashed banana', '¼ cup organic (no sugar added) applesauce', '2 Tbsp coconut oil (melted)', '1 tsp. vanilla extract', '1½ Tbsp cinnamon', '3 tsp. baking powder', 'Pinch of sea salt', '½ cup blueberries']",124.0,6.9,16.2,3.8
43,Clean Egg & Zucchini Muffins,https://www.eatyourselfskinny.com/clean-egg-zucchini-muffins/,"['14 egg whites', '4 whole eggs', '4 green onions chopped', '2 carrots shredded', '½ red bell pepper minced', '½ zucchini shredded', '½ tsp. dried basil', '¼ tsp. dried oregano', 'Sprinkle of sea salt and pepper to taste']",123.0,3.5,15.8,3.1
44,Guilt-Free Oatmeal Raisin Cookies,https://www.eatyourselfskinny.com/guilt-free-oatmeal-raisin-cookies/,"['1½ cup old fashioned rolled oats', '1 cup unsweetened coconut flakes', '½ tsp. sea salt', '1 tsp. cinnamon', '½ tsp. allspice', '½ cup mixed nuts finely chopped (I used pecans walnuts and almonds)', '1 cup raisins', '3 ripe bananas mashed', '¼ cup plain Greek yogurt', '1 tsp. vanilla extract']",88.0,14.5,1.8,3.3
45,Chia Seed Quinoa Muffins,https://www.eatyourselfskinny.com/chia-seed-quinoa-muffins/,"['2 cups cooked quinoa', '¼ cup plain Greek yogurt', '1 cup whole wheat flour', '1 cup all-purpose flour', '2 Tbsp brown sugar', '1½ tsp. baking powder', '1 tsp. salt', '2 Tbsp chia seeds', '¾ cup unsweetened almond milk', '1 egg', '2 Tbsp honey', '1 tsp. vanilla extract']",110.0,20.6,4.0,1.5
46,Raspberry Honey Parfait,https://www.eatyourselfskinny.com/raspberry-honey-parfait/,"['1 cup raspberries', '2 tsp. honey', '½ cup non-fat vanilla Greek yogurt', '½ cup fat-free Cool Whip', '2 Tbsp granola']",144.0,23.6,6.7,0.7
47,Zucchini Cupcakes with Greek Yogurt Frosting,https://www.eatyourselfskinny.com/zucchini-cupcakes-with-greek-yogurt-frosting/,"['1 cup whole wheat flour', '¼ cup raw sugar', '¼ cup brown sugar packed', '1 tsp. ground cinnamon', '½ tsp. baking powder', '½ tsp. salt', '¼ tsp. baking soda', '2 eggs', '¼ cup almond milk', '1 cup cooked quinoa', '1 cup shredded zucchini', '¾ cup unsweetened applesauce', '1 tsp. vanilla', '6 oz. plain fat-free Greek Yogurt', '2 Tbsp honey', '1 tsp. vanilla', '1 tsp. lemon peel (as garnish)']",128.0,26.0,4.8,1.3
48,Post-Workout Banana Bites,https://www.eatyourselfskinny.com/post-workout-banana-bites/,"['5 bananas', '2 oz. vanilla Greek Yogurt', '1 Tbsp all-natural peanut butter']",110.0,23.6,2.5,1.6
49,Apple Cinnamon Baked Oatmeal,https://www.eatyourselfskinny.com/apple-cinnamon-baked-oatmeal/,"['2 cups rolled oats', '1½ tsp. baking powder', '¾ tsp. salt', '2 Tbsp chopped pecans', '¼ cup raisins', '2 cups diced apples (I used Granny Smith)', '3 eggs', '2 cups almond milk (or milk of your choice)', '½ tsp. vanilla extract', '3 Tbsp Splenda brown sugar blend (or ⅓ cup light brown sugar)', '½ tsp. ground cinnamon', '¼ tsp. nutmeg']",130.0,23.0,5.2,2.5
50,Whole Wheat Pumpkin Muffins,https://www.eatyourselfskinny.com/whole-wheat-pumpkin-muffins/,"['1 cup whole wheat flour', '½ cup all-purpose flour', '1 tsp. baking powder', '¼ tsp. baking soda', '1½ tsp. pumpkin spice', '½ tsp. cinnamon', '¼ cup + 2 Tbsp unsweetened applesauce', '1 cup pumpkin puree', '½ cup plain non-fat Greek yogurt', '1 egg', '½ cup raw sugar + 1 Tbsp for topping', '2 Tbsp chopped walnuts for topping', '1 Tbsp rolled oats if desired']",120.0,23.4,4.8,1.4
51,Rosemary and Sweet Potato Tart,https://www.eatyourselfskinny.com/rosemary-and-sweet-potato-tart/,"['1 sheet frozen puff pastry thawed', 'Flour for surface', '½ cup grated Gouda cheese', '¼ cup chopped walnuts toasted', 'Fresh rosemary and thyme as desired', 'For caramelized sweet potatoes:', '2 small sweet potatoes peeled and cut into ¼-inch thick rounds', '2 Tbsp olive oil', '1 Tbsp garlic minced', '½ cup of dry white wine', '¾ cup of low-sodium chicken stock', '1 Tbsp packed dark-brown sugar', '½ tsp. sea salt']",180.0,12.8,0.8,11.0
52,Gingerbread Apple Pancakes,https://www.eatyourselfskinny.com/gingerbread-apple-pancakes/,"['1 cup all-purpose flour', '1¼ cups whole wheat flour', '¼ cup packed brown sugar', '2 tsp. baking powder', '1 tsp. ground ginger', '1 tsp. cinnamon', '¼ tsp. nutmeg', '½ tsp. baking soda', '½ tsp. salt', '2 eggs lightly beaten', '1½ cups non-fat buttermilk', '3 Tbsp unsweetened applesauce']",92.0,17.5,3.6,0.7
53,Cranberry-Maple Cinnamon Rolls,https://www.eatyourselfskinny.com/cranberry-maple-cinnamon-rolls/,"['1 cup fat-free milk', '2 Tbsp pure maple syrup (or agave nectar)', '2 Tbsp butter', '1 tsp. salt', '¼ cup warm water', '1 package active dry yeast', '1 egg lightly beaten', '1¼ cups whole wheat flour', '2½ cups all purpose flour', '⅓ cup packed brown sugar', '2 tsp. ground cinnamon', '¼ cup dried cranberries', '¼ cup chopped pecans toasted', 'Maple-Brown Sugar Icing:', '2 Tbsp packed brown sugar', '1 Tbsp very hot water', '¾ cup powdered sugar', '¼ tsp. maple flavoring', '1-2 tsp. fat-free milk']",180.0,33.0,5.0,4.0
54,Apple Cinnamon Quinoa Cereal,https://www.eatyourselfskinny.com/apple-cinnamon-quinoa-cereal/,"['1 cup uncooked quinoa', '1 Tbsp butter divided', '2 medium apples chopped', '1½ cups cold water', '1 tsp. cinnamon', '½ tsp. apple pie spice', '3 Tbsp organic brown sugar', '¼ cup fat-free skim milk']",168.0,30.7,4.7,3.1
55,Lemon-Poppy Seed Zucchini Bread,https://www.eatyourselfskinny.com/lemon-poppy-seed-zucchini-bread/,"['4 Tbsp butter', '4 Tbsp unsweetened applesauce', '1 cup sugar', '3 large eggs', '1½ cups all-purpose flour', '½ tsp. salt', '⅛ tsp. baking soda', '½ cup fat-free plain yogurt', '1 cup shredded zucchini', '1 Tbsp lemon zest', '2 tsp. poppy seeds']",173.0,29.2,3.8,5.0
56,"Kiwi, Pineapple & Chia Seed Smoothie",https://www.eatyourselfskinny.com/kiwi-pineapple-chia-seed-smoothie/,"['2 cups fresh baby spinach', '1 cup sliced kiwi', '1 banana cut up', '½ cup plain Greek yogurt', '¼ cup chopped fresh pineapple', '¼ cup fresh orange juice', '2 Tbsp. chia seeds']",219.0,41.0,8.0,5.0
57,Caramelized Peaches with Fresh Rosemary,https://www.eatyourselfskinny.com/caramelized-peaches-with-fresh-rosemary/,"['2 Tbsp olive oil', '¼ cup raw honey', '4 ripe medium peaches halved and pitted', '2 Tbsp fresh orange juice', '2 tsp. fresh rosemary snipped']",195.0,32.0,2.1,6.5
58,Cinnamon and Honey Spiced Grapefruit,https://www.eatyourselfskinny.com/cinnamon-and-honey-spiced-grapefruit/,"['½ grapefruit', '1 Tbsp honey', '½ tsp. vanilla extract', 'Pinch of cardamom', 'Pinch of cinnamon', 'Pinch of nutmeg']",118.0,30.5,1.0,0.0
59,Skinny Cinnamon Raisin Scones,https://www.eatyourselfskinny.com/skinny-cinnamon-raisin-scones/,"['2 cups whole wheat flour', '¼ cup brown sugar', '3 tsp baking powder', '½ tsp. salt', '3 Tbsp cold light butter', '¼ cup fat-free milk', '2 tsp. vanilla extract', '1 tsp. cinnamon', '2 eggs', '½ cup raisins (microwave with a teaspoon of water to plump)', 'For glaze:', '½ cup powdered sugar', '2 tsp. fat-free milk', '¼ tsp. vanilla extract']",151.0,30.0,3.5,1.8
60,Spinach and Egg White Omelet,https://www.eatyourselfskinny.com/spinach-and-egg-white-omelet/,"['3 egg whites', 'Handful of spinach (about ½ cup)', '½ cup onion', '4 or 5 grape tomatoes', 'Salt and pepper to taste']",70.0,3.7,11.7,0.0
61,"Zucchini, Squash & Ricotta Galette",https://www.eatyourselfskinny.com/zucchini-squash-ricotta-galette/,"['Crust:', '1½ cups whole wheat flour', '¼ tsp. sea salt', '8 Tbsp light butter cold', '2 oz. light cream cheese', '¼ cup of ice water adding an additional tablespoon if necessary', 'Filling:', '1 medium zucchini', '1 medium yellow summer squash', '1 clove garlic', '1 cup ricotta cheese', '1 Tbsp honey', '1 egg white', '1 Tbsp fresh thyme', '½ cup Parmesan cheese grated', '¼ cup mozzarella cheese shredded', 'Egg wash:', '1 egg yolk', '1 tsp. water', 'Topping:', '1 Tbsp olive oil', 'Fresh basil']",164.0,15.1,7.0,8.5
62,"Strawberries, Peaches, Basil & Orange Vinaigrette",https://www.eatyourselfskinny.com/strawberries-peaches-basil-orange-vinaigrette/,"['1 cup fresh orange juice', '2 or 3 packets Stevia', '1½ Tbsp champagne vinegar', '1 Tbsp extra-virgin olive oil', 'Dash of salt', '1½ cups fresh blueberries', '1 lb. fresh strawberries halved', '1 large peach cut into wedges', '¼ cup fresh basil leaves']",163.0,32.5,2.1,4.2
63,Whole Wheat Banana Waffles,https://www.eatyourselfskinny.com/whole-wheat-banana-waffles/,"['2 cups whole wheat flour', '2 eggs beaten', '1¾ cup skim milk', '½ cup unsweetened applesauce', '4 tsp. baking powder', '1 ripe banana mashed', '1½ packets Stevia (or 1 Tbsp sugar)', '¼ tsp. sea salt', '½ tsp. cinnamon', '¼ tsp. nutmeg', '1 tsp. vanilla extract']",214.0,40.3,10.2,2.6
64,Lemon Curd with Mixed Berries,https://www.eatyourselfskinny.com/lemon-curd-with-mixed-berries/,"['⅔ cup sugar', '½ cup fresh lemon juice', '¼ cup fresh orange juice', '⅛ tsp. salt', '6 large egg yolks', '3 Tbsp light butter cut into small pieces', '2 tsp. grated lemon zest', '1½ cups blueberries', '1½ cups raspberries', '3 Tbsp granola (I used Special K low-fat granola)']",174.0,24.4,2.7,7.0
